{
  "resourceType": "Bundle",
  "type": "collection",
  "meta": {
    "source": "manual-review-v1",
    "lastUpdated": "2026-01-01T00:00:00Z"
  },
  "entry": [
    {
      "resource": {
        "resourceType": "Patient",
        "id": "patient-1",
        "name": [{ "use": "official", "family": "Doe", "given": ["Jane"] }],
        "gender": "female",
        "birthDate": "1965-03-15"
      }
    },
    {
      "resource": {
        "resourceType": "Encounter",
        "id": "encounter-1",
        "status": "finished",
        "class": {
          "system": "http://terminology.hl7.org/CodeSystem/v3-ActCode",
          "code": "AMB",
          "display": "ambulatory"
        },
        "subject": { "reference": "Patient/patient-1" }
      }
    },
    {
      "resource": {
        "resourceType": "Condition",
        "id": "condition-1",
        "clinicalStatus": {
          "coding": [{
            "system": "http://terminology.hl7.org/CodeSystem/condition-clinical",
            "code": "active"
          }]
        },
        "verificationStatus": {
          "coding": [{
            "system": "http://terminology.hl7.org/CodeSystem/condition-ver-status",
            "code": "confirmed"
          }]
        },
        "code": {
          "coding": [{
            "system": "http://hl7.org/fhir/sid/icd-10-cm",
            "code": "REPLACE",
            "display": "REPLACE"
          }]
        },
        "subject": { "reference": "Patient/patient-1" },
        "encounter": { "reference": "Encounter/encounter-1" }
      }
    },
    {
      "resource": {
        "resourceType": "MedicationStatement",
        "id": "med-1",
        "status": "active",
        "medicationCodeableConcept": {
          "coding": [{
            "system": "http://www.nlm.nih.gov/research/umls/rxnorm",
            "code": "REPLACE",
            "display": "REPLACE"
          }]
        },
        "subject": { "reference": "Patient/patient-1" },
        "dosage": [{
          "text": "REPLACE",
          "route": {
            "coding": [{
              "system": "http://snomed.info/sct",
              "code": "26643006",
              "display": "Oral route"
            }]
          }
        }]
      }
    },
    {
      "resource": {
        "resourceType": "Observation",
        "id": "obs-1",
        "status": "final",
        "code": {
          "coding": [{
            "system": "http://loinc.org",
            "code": "REPLACE",
            "display": "REPLACE"
          }]
        },
        "subject": { "reference": "Patient/patient-1" },
        "encounter": { "reference": "Encounter/encounter-1" },
        "valueQuantity": {
          "value": 0,
          "unit": "REPLACE",
          "system": "http://unitsofmeasure.org",
          "code": "REPLACE"
        }
      }
    },
    {
      "resource": {
        "resourceType": "AllergyIntolerance",
        "id": "allergy-1",
        "clinicalStatus": {
          "coding": [{
            "system": "http://terminology.hl7.org/CodeSystem/allergyintolerance-clinical",
            "code": "active"
          }]
        },
        "type": "allergy",
        "code": {
          "coding": [{
            "system": "http://www.nlm.nih.gov/research/umls/rxnorm",
            "code": "REPLACE",
            "display": "REPLACE"
          }]
        },
        "patient": { "reference": "Patient/patient-1" },
        "reaction": [{
          "manifestation": [{
            "coding": [{
              "system": "http://snomed.info/sct",
              "code": "REPLACE",
              "display": "REPLACE"
            }]
          }]
        }]
      }
    }
  ]
}
